{
  "competitor_id": "public-case-real-estate-studio-estudio-de-renders-arquitectonicos-tradicional",
  "company_id": "public-case-real-estate-studio",
  "name": "Estudio de renders arquitectonicos tradicional",
  "website": "",
  "competitor_type": "direct",
  "geography": [
    "Mexico"
  ],
  "positioning_summary": "Render y visualizacion arquitectonica por pieza, con foco en imagen final y no en conversion comercial.",
  "pricing_summary": "Cobro por pieza o por paquete de renders; suele subir con cada ronda adicional.",
  "channels": [
    "referidos",
    "instagram",
    "website"
  ],
  "strengths": [
    "calidad visual",
    "capacidad de producir piezas hero"
  ],
  "weaknesses": [
    "no piensa en landing, CRM, brokers ni sala de ventas",
    "la actualizacion puede volverse lenta y costosa"
  ],
  "trust_signals": [
    "portafolio de renders",
    "experiencia tecnica de visualizacion"
  ],
  "status": "inferred",
  "confidence": 0.79,
  "source_origin": "competitor_engine",
  "evidence_refs": [
    "2026-03-18-preventa-necesita-material-que-si-venda",
    "2026-03-18-cambios-de-proyecto-rompen-las-piezas",
    "2026-03-18-tour-360-filtra-visitas",
    "2026-03-18-confianza-remota-antes-del-showroom"
  ],
  "source_refs": [
    "2026-03-18-matterport-mx-inmobiliario",
    "2026-03-18-shot360-articulo",
    "2026-03-18-tour360-recorridos"
  ],
  "assumption_refs": [
    "public-case-real-estate-studio-estudio-de-renders-arquitectonicos-tradicional-assumption-pricing"
  ],
  "finding_refs": [],
  "validated_fact_refs": [],
  "created_at": "2026-03-18T17:07:10",
  "updated_at": "2026-03-18T17:07:10"
}
